title,time,date,link,content,symbols_found
NLP Motorcycles lanza sus modelos insignia en la Expo de Pekín 2025,"Apr 11, 2025, 12:01 ET",2025-04-13,https://www.prnewswire.com/news-releases/nlp-motorcycles-lanza-sus-modelos-insignia-en-la-expo-de-pekin-2025-302426678.html,"Apr 11, 2025, 12:01 ET
Share this article
-Kengyi Technology (Guangdong) Co., Ltd. lanza los modelos insignia de NLP Motorcycles en la Expo de Pekín 2025
BEIJING,11 de abril de 2025/PRNewswire/ --NLP Motorcycles, una marca global de motocicletas de lujo, presentó sus modelos insignia de alto rendimiento, lasseries DEVILS ST y ULTAIL GL, en la Exposición Internacional de Motocicletas de Pekín 2025 (Stand H12, Pabellón W2). Este debut subraya el enfoque de NLP de ""producción conforme a las normas + personalización premium"", superando las restricciones tradicionales de modificación para ofrecer soluciones legales, de alto rendimiento y personalizadas a motociclistas de todo el mundo, redefiniendo así el valor de las motocicletas premium.
Innovación clave: cumplimiento y personalizaciónLas motocicletas de NLP cumplen con elsistema de certificación global de WMIy los estándares 3C, y se producen en fábricas extranjeras para garantizar el cumplimiento del registro a nivel nacional, eliminando así los obstáculos regulatorios regionales. Al diseñar vehículos que superan los límites de modificación ""1087"" deChina, NLP resuelve los desafíos de compatibilidad y posventa, permitiendo unapersonalización legal y una conducción sin preocupaciones.
Innovación clave: cumplimiento y personalizaciónLas motocicletas de NLP cumplen con elsistema de certificación global de WMIy los estándares 3C, y se producen en fábricas extranjeras para garantizar el cumplimiento del registro a nivel nacional, eliminando así los obstáculos regulatorios regionales. Al diseñar vehículos que superan los límites de modificación ""1087"" deChina, NLP resuelve los desafíos de compatibilidad y posventa, permitiendo unapersonalización legal y una conducción sin preocupaciones.
Visión de marca: libertad sin fronterasNLP afirmó:""La libertad al volante debe trascender políticas, costes y barreras técnicas. Capacitamos a los motociclistas para fusionar tecnología y arte, transformando las motocicletas en extensiones de su identidad"".
Impacto estratégico: redefiniendo la movilidad de lujoNLP es pionera en lapersonalización de vehículos de lujo homologadospara circular por carretera,combinando rendimiento y exclusividad, a la vez que transforma el comportamiento del consumidor de las compras estandarizadas a""ecosistemas de movilidad personalizada"". Establece puntos de referencia técnicos y comerciales escalables para los mercados globales de vehículos personalizados.
Acerca de NLP MotorcyclesNLP reinventa la cultura de la conducción a través de ingeniería y diseño de vanguardia, ofreciendo vehículos compatibles, personalización a medida y servicios de ciclo de vida para promover la legalización, la personalización y la sostenibilidad de la industria.
Contacto para medios:Peggy | Tel: +86-13929919443 | Email:[email protected]
(Explore los detalles en el stand H12, pabellón W2 – Exposición de Motocicletas de Pekín 2025.)
Foto -https://mma.prnewswire.com/media/2662738/1.jpg",[]
"AUTOBELL® CAR WASH ADDS LOCATION IN GROWING GREATER CHARLESTON MARKET, DEBUTS FLEXIBLE DESIGN CONCEPT","Apr 11, 2025, 11:26 ET",2025-04-13,https://www.prnewswire.com/news-releases/autobell-car-wash-adds-location-in-growing-greater-charleston-market-debuts-flexible-design-concept-302425971.html,"Apr 11, 2025, 11:26 ET
Share this article
CHARLOTTE, N.C.,April 11, 2025/PRNewswire/ --Autobell Car Wash,headquartered here, recently opened its thirdSummerville, SC, location with a new wash in the growing Cane Bay community.
Autobell debuted in the greaterCharleston, SC, market in 2016 and now has six washes there, with other locations inSummerville,North Charleston,Johns Island, andCharleston(James Island).
Family-owned Autobell, celebrating 56 years in business next month, currently operates 91 washes in five states.
The Cane Bay wash is the first to feature a new Autobell design based on the modular concept, allowing the company to utilize either stick-built construction or pre-engineered components as needed to conform to future sites. This concept reduces ongoing architectural and engineering costs by creating a simple yet flexible design that allows customization in layout and construction to fit any site.
The new Summerville Autobell will employ approximately 20 full- and part-time team members.Charlie Canappwill lead the Autobell team at the new location as Store Manager.
Charleston District Manager Doug Robinson, a 19-year Autobell veteran, stated, ""It's been exciting to participate in the growth of Autobell in this market and help establish new locations that offer our customers excellent service, dependable quality, and increased convenience.""
Autobell Car Washservicesrange from full-service cleaning with interior and exterior finishing options completed by Autobell team members within minutes, to exterior-only washes that cater to customers' daily needs.
The company offers multi-levelUnlimitedSMcar wash plans that provide unlimited washes for a set monthly charge, as well as theAutobell Appthat allows customers to pre-purchase washes and skip the line while earningMy Autobell Rewards.
ABOUT AUTOBELL
Celebrating 56 years of service,Charlotte, NC-based Autobell Car Wash remains unwavering in its focus on customers and the cars they love. Founded in 1969 by the lateCharles Howard Sr., Autobell is privately held and operated by subsequent generations of the Howard family.
Autobell is a conveyorized car wash with a range of exterior and interior cleaning and finishing services completed by its team members within minutes, saving customers time and effort. The company currently operates 91 locations in the Southeast and Mid-Atlantic, with consistent expansion.
Autobell prioritizesteam member training and development,community involvement, its scholarship andfundraisingprograms, and environmental protection and conservation. All Autobell washes treat 100% of wash water used and recycle up to 100% using innovative, environmentally friendly systems.
For more information, visitautobell.com.
MEDIA ASSETS FOR DOWNLOAD
MEDIA CONTACT:Hensley Fontana Public Relations704-542-0607 office704-904-4495 mobile[email protected]
SOURCE Autobell Car Wash",[]
"Kengyi Technology (Guangdong) Co., Ltd. Launches NLP Motorcycles' Flagship Models at 2025 Beijing Expo","Apr 11, 2025, 11:16 ET",2025-04-13,https://www.prnewswire.com/news-releases/kengyi-technology-guangdong-co-ltd-launches-nlp-motorcycles-flagship-models-at-2025-beijing-expo-302426644.html,"Apr 11, 2025, 11:16 ET
Share this article
BEIJING,April 11, 2025/PRNewswire/ --NLP Motorcycles, a global luxury motorcycle brand, premiered its high-performance flagship models—DEVILS ST SeriesandULTAIL GL Series—at the 2025 Beijing International Motorcycle Exhibition (Booth H12, Hall W2). This debut underscores NLP's""compliant production + premium customization""approach, overcoming traditional modification restrictions to deliver legal, high-performance, and personalized solutions for riders worldwide, redefining premium motorcycle value.
Core Innovation: Compliance Meets CustomizationNLP's motorcycles adhere to theWMI global certification systemand 3C standards, produced in overseas-owned factories to ensure nationwide registration compliance, eliminating regional regulatory hurdles. By engineering vehicles to transcendChina's""1087"" modification limits, NLP resolves compatibility and post-sales challenges, enabling""legal customization, worry-free riding.""
Core Innovation: Compliance Meets CustomizationNLP's motorcycles adhere to theWMI global certification systemand 3C standards, produced in overseas-owned factories to ensure nationwide registration compliance, eliminating regional regulatory hurdles. By engineering vehicles to transcendChina's""1087"" modification limits, NLP resolves compatibility and post-sales challenges, enabling""legal customization, worry-free riding.""
Brand Vision: Freedom Beyond BoundariesNLP asserts:""Riding freedom must transcend policies, costs, or technical barriers. We empower riders to fuse technology and artistry, transforming motorcycles into extensions of their identity.""
Strategic Impact: Redefining Luxury MobilityNLP pioneersroad-legal luxury customization, merging performance with exclusivity while shifting consumer behavior from standardized purchases to""personalized mobility ecosystems.""It establishes scalable technical and commercial benchmarks for global custom markets.
About NLP MotorcyclesNLP reimagines riding culture through cutting-edge engineering and design, offering compliant vehicles, bespoke customization, and lifecycle services to advance industry legalization, personalization, and sustainability.
Media Contact:Peggy | Tel: +86-13929919443 | Email:[email protected]
(Explore details at Booth H12, Hall W2 – 2025 Beijing Motorcycle Exhibition.)
Photo -https://mma.prnewswire.com/media/2662738/1.jpg",[]
"Kengyi Technology (Guangdong) Co., Ltd. Launches NLP Motorcycles' Flagship Models at 2025 Beijing Expo","Apr 11, 2025, 11:01 ET",2025-04-13,https://www.prnewswire.com/news-releases/kengyi-technology-guangdong-co-ltd-launches-nlp-motorcycles-flagship-models-at-2025-beijing-expo-302426636.html,"Apr 11, 2025, 11:01 ET
Share this article
BEIJING,April 11, 2025/PRNewswire/ --NLP Motorcycles, a global luxury motorcycle brand, premiered its high-performance flagship models—DEVILS ST SeriesandULTAIL GL Series—at the 2025 Beijing International Motorcycle Exhibition (Booth H12, Hall W2). This debut underscores NLP's""compliant production + premium customization""approach, overcoming traditional modification restrictions to deliver legal, high-performance, and personalized solutions for riders worldwide, redefining premium motorcycle value.
Core Innovation: Compliance Meets CustomizationNLP's motorcycles adhere to theWMI global certification systemand 3C standards, produced in overseas-owned factories to ensure nationwide registration compliance, eliminating regional regulatory hurdles. By engineering vehicles to transcendChina's""1087"" modification limits, NLP resolves compatibility and post-sales challenges, enabling""legal customization, worry-free riding.""
Core Innovation: Compliance Meets CustomizationNLP's motorcycles adhere to theWMI global certification systemand 3C standards, produced in overseas-owned factories to ensure nationwide registration compliance, eliminating regional regulatory hurdles. By engineering vehicles to transcendChina's""1087"" modification limits, NLP resolves compatibility and post-sales challenges, enabling""legal customization, worry-free riding.""
Brand Vision: Freedom Beyond BoundariesNLP asserts:""Riding freedom must transcend policies, costs, or technical barriers. We empower riders to fuse technology and artistry, transforming motorcycles into extensions of their identity.""
Strategic Impact: Redefining Luxury MobilityNLP pioneersroad-legal luxury customization, merging performance with exclusivity while shifting consumer behavior from standardized purchases to""personalized mobility ecosystems.""It establishes scalable technical and commercial benchmarks for global custom markets.
About NLP MotorcyclesNLP reimagines riding culture through cutting-edge engineering and design, offering compliant vehicles, bespoke customization, and lifecycle services to advance industry legalization, personalization, and sustainability.
Media Contact:Peggy | Tel: +86-13929919443 | Email:[email protected]
(Explore details at Booth H12, Hall W2 – 2025 Beijing Motorcycle Exhibition.)
SOURCE NLP motorcycles",[]
123Invent Inventors Develop New Rubber Duck Display for Jeep-Style Vehicles (MHO-573),"Apr 11, 2025, 10:45 ET",2025-04-13,https://www.prnewswire.com/news-releases/123invent-inventors-develop-new-rubber-duck-display-for-jeep-style-vehicles-mho-573-302425286.html,"Apr 11, 2025, 10:45 ET
Share this article
PITTSBURGH,April 11, 2025/PRNewswire/ -- ""Owners of jeep-style vehicles like to share little rubber ducks as a morale booster, and often times, they are displayed on the dashboard which can impede the defroster and cause safety issues. We thought there could be a better way to display the collection of ducks,"" said one of two inventors, from Caseyville, Ill., ""so we invented the DUCK DASH. Our design offers a unique way to display them out of the way.""
The invention provides an improved way to display little rubber ducks within a jeep-style vehicle. In doing so, it eliminates the need to display them on the dashboard. As a result, it helps prevent safety issues, and it would not impede the defroster. It also could help boost morale amongst vehicle owners. The invention features a unique design that is easy to apply and use so it is ideal for the owners of jeep-style vehicles.
The DUCK DASH is currently available for licensing or sale to manufacturers or marketers. For more information, visitwww.theduckdash.net.Or contact Justin Ford & Christy Kelso at 469-325-2493 or email[email protected].
SOURCE InventHelp",['F']
"Dana Incorporated to Announce 2025 First-quarter Financial Results, Host Conference Call and Webcast on April 30","Apr 11, 2025, 09:00 ET",2025-04-13,https://www.prnewswire.com/news-releases/dana-incorporated-to-announce-2025-first-quarter-financial-results-host-conference-call-and-webcast-on-april-30-302426321.html,"Apr 11, 2025, 09:00 ET
Share this article
MAUMEE, Ohio,April 11, 2025/PRNewswire/ -- Dana Incorporated (NYSE:DAN) will release its 2025 first-quarter financial results onWednesday, April 30, 2025. A press release will be issued at approximately7 a.m. EDT, followed by a conference call and webcast at9 a.m. EDT. Members of the company's senior management team will be available at that time to discuss the results and answer related questions.
The conference call can be accessed by telephone from both domestic and international locations using the information provided below:
Conference ID: 9943139Participant Toll-Free Dial-In Number: 1 (888) 440-5873Participant Toll Dial-In Number: 1 (646) 960-0319
Audio streaming and slides will be available online via a link provided on the Dana investor website:www.dana.com/investors.
A webcast replay can be accessed via Dana's investor website following the call.
About Dana IncorporatedDana is a leader in the design and manufacture of highly efficient propulsion and energy-management solutions that power vehicles and machines in all mobility markets across the globe. The company is shaping sustainable progress through its conventional and clean-energy solutions that support nearly every vehicle manufacturer with drive and motion systems; electrodynamic technologies, including software and controls; and thermal, sealing, and digital solutions.
Based inMaumee, Ohio, USA, the company reported sales of$10.3 billionin 2024 with 39,000 people in 30 countries across six continents.  With a history dating to 1904, Dana was named among the ""World's Most Ethical Companies"" for 2025 by Ethisphere and as one of ""America's Most Responsible Companies 2025"" by Newsweek.  The company is driven by a high-performance culture that focuses on valuing others, inspiring innovation, growing responsibly, and winning together, earning it global recognition as a top employer.  Learn more at dana.com.
SOURCE Dana Incorporated",[]
El HONGQI E-HS9 se incorpora oficialmente a la flota de servicio VIP del aeropuerto de Frankfurt,"Apr 11, 2025, 08:58 ET",2025-04-13,https://www.prnewswire.com/news-releases/el-hongqi-e-hs9-se-incorpora-oficialmente-a-la-flota-de-servicio-vip-del-aeropuerto-de-frankfurt-302426568.html,"Apr 11, 2025, 08:58 ET
Share this article
FRANKFURT, Alemania,11 de abril de 2025/PRNewswire/ -- El HONGQI E-HS9 se ha incorporado oficialmente a la flota de servicios VIP del Aeropuerto deFrankfurt, ofreciendo transporte prémium y cómodo para invitados distinguidos, incluyendo altos funcionarios gubernamentales y líderes empresariales. Con su sofisticado diseño y avanzadas prestaciones, el HONGQI E-HS9 aporta un lujo inigualable al servicio VIP del aeropuerto deFrankfurt.
Desde la primera entrega del HONGQI E-HS9 al aeropuerto deFrankfurty su posterior prueba de funcionamiento el año pasado, ha recibido grandes elogios por su excepcional calidad de vuelo y seguridad, demostrando un rendimiento y una fabricación excepcionales. Esta acogida positiva no solo ha reforzado la confianza del aeropuerto en la marca HONGQI, sino que también ha sentado una base sólida para una mayor colaboración. El aeropuerto planea ahora integrar el HONGQI H9 en su flota, reforzando la colaboración y mejorando conjuntamente la experiencia de los viajes de lujo.
Desde la primera entrega del HONGQI E-HS9 al aeropuerto deFrankfurty su posterior prueba de funcionamiento el año pasado, ha recibido grandes elogios por su excepcional calidad de vuelo y seguridad, demostrando un rendimiento y una fabricación excepcionales. Esta acogida positiva no solo ha reforzado la confianza del aeropuerto en la marca HONGQI, sino que también ha sentado una base sólida para una mayor colaboración. El aeropuerto planea ahora integrar el HONGQI H9 en su flota, reforzando la colaboración y mejorando conjuntamente la experiencia de los viajes de lujo.
Los HONGQI E-HS9 y H9 integran a la perfección tecnología avanzada con un diseño exquisito. Su excepcional calidad de conducción, combinada con interiores refinados y sofisticados, ofrece a cada pasajero un momento de relajación privado y elegante. La batería ternaria de iones de litio de alto rendimiento del E-HS9 y el sistema de tracción a las cuatro ruedas con doble motor garantizan un viaje eficiente y sin contratiempos. La atención al detalle es esencial para HONGQI, con características exclusivas como las luces de bienvenida iluminadas ""Wing of HONGQI"" en el H9, que demuestran la elegancia de la marca. El Sistema Electrónico de Cortesía utiliza tecnología avanzada para brindar a los VIP una experiencia de viaje inteligente y cómoda. Los HONGQI E-HS9 y H9 encarnan a la perfección la fusión de lujo, elegancia y confort, ofreciendo un viaje extraordinario y refinado en cada viaje.
El E-HS9 es el primer vehículo de HONGQI que se exporta a Europa. Desde su lanzamiento en 2020, ha generado un gran interés en el mercado europeo, llegando a países como Noruega, Países Bajos y Suecia. La incorporación del E-HS9 y el H9 a la flota VIP del Aeropuerto deFrankfurtno solo mejora la oferta de servicios de lujo del aeropuerto, sino que también consolida la posición de HONGQI como actor clave en el sector global de la automoción de lujo. Cabe destacar que los últimos modelos de HONGQI, el EH7 y el EHS7, ya se han lanzado y están a la venta, y el primer lote de vehículos ya ha llegado a Europa. De cara al futuro, HONGQI planea introducir más vehículos de nueva energía en el mercado europeo, para seguir ofreciendo opciones de conducción exclusivas y lujosas a los clientes europeos.
Sitio web:https://www.hongqi-auto.comEHS9:https://www.hongqi-auto.com/go/bVFWxffzH9:https://www.hongqi-auto.com/go/2SXq2d3DEHS7:https://www.hongqi-auto.com/go/EFRv5UQyEH7:https://www.hongqi-auto.com/go/UoPMng9t
Foto -https://mma.prnewswire.com/media/2662793/image_5028817_38419043.jpg",[]
"Lidar Industry Enters Mass Adoption Phase, Hesai Remains Leader In Global Market Share","Apr 11, 2025, 08:30 ET",2025-04-13,https://www.prnewswire.com/news-releases/lidar-industry-enters-mass-adoption-phase-hesai-remains-leader-in-global-market-share-302426520.html,"Apr 11, 2025, 08:30 ET
Share this article
PALO ALTO, Calif.,April 11, 2025/PRNewswire/ -- Hesai Group (Nasdaq:HSAI), the global leader in lidar technology for automotive mobility and robotics application, has been named the top automotive lidar company by market share for the fourth consecutive year byYole Group, a global advisory and market analysis firm recognized for its expertise in the semiconductor, photonic, and electronic sectors. The report highlights Hesai's continued leadership in the global lidar industry, emphasizing its market-leading revenue share, and dominant presence across both ADAS-enabled passenger cars and the robotaxi segment. This leadership position was bolstered by strategic partnerships with leading global OEMs, ongoing technological innovations, and rapidly growing demand in both the passenger car segment and robotaxi market.
Yole Group's ""Lidar for Automotive 2025"" report, which ranks lidar companies by several key indicators of success, noted that Hesai captured 33% of the global market by revenue in 2024. The market has witnessed enormous growth of 60% year-on-year to reach a value of$859 million.
Yole Group's ""Lidar for Automotive 2025"" report, which ranks lidar companies by several key indicators of success, noted that Hesai captured 33% of the global market by revenue in 2024. The market has witnessed enormous growth of 60% year-on-year to reach a value of$859 million.
Hesai's leadership is particularly evident in the rapidly expanding ADAS-enabled passenger vehicle market, which is experiencing explosive growth, particularly inChina. Yole Group reports that around 120 vehicle models have adopted lidar since 2018, with adoption accelerating. Nearly 40 new lidar-equipped models have launched in the last two years alone. As the technology continues to grow in popularity, Chinese automakers are now implementing lidar beyond luxury vehicles, into more affordable, mass-market models, including C-segment cars priced around$25,000. This democratization drove the ADAS passenger car lidar market to grow by 68% year-on-year in 2024. This marks a major turning point for the industry as it enters a true mass adoption phase.
Hesai's scalability, vertical integration, and strategic design wins with 22 OEMs across over 120 models have made it a top supplier in this segment. According to the report, industry leaders, including BYD and Li Auto, are driving this momentum. BYD's ""God's Eye"" intelligent driving system is now available in mass-market models, and Li Auto plans to standardize lidar across its entire 2025 lineup.
In the robotaxi market specifically, Hesai dominates with a commanding 61% market share, supplying industry leaders such as Zoox, Aurora, Apollo, Didi, Pony, and WeRide.
Looking toward 2025, Yole Group expects the adoption of lidar-based ADAS systems, particularly driven by recent commitments from Chinese players, will push lidar installations beyond three million units. Hesai's growth in tandem with the industry will enable it to remain a leader in the market.
""We are proud to be recognized by Yole Group as the leader in the global lidar market for the fourth year in a row,"" saidDavid Li, CEO & Co-Founder of Hesai. ""Lidar is experiencing transformative growth as automakers increasingly rely on the technology to drastically increase safety and reliability across both manned and autonomous vehicles. Our advantage lies in the speed and scale at which we innovate and manufacture, driven by our initiative of delivering ultimate performance and ultimate value-to-cost.""
""Hesai's continued market leadership reflects their sound business model and innovation capabilities across the sector,"" saidPierrick Boulay, Senior Analyst at Yole Group. ""The Company is uniquely positioned to capitalize on new opportunities as the industry continues to grow.""
Hesai continues to report the strongest revenue amongst its competitors and is the only company in the industry to have achieved full-year non-GAAP1 profitability. To date, Hesai has secured design wins with 22 automotive OEMs for over 120 vehicle models globally. InDecember 2024, Hesai became the first lidar company in the world to deliver more than 100,000 units in a single month.
Note:The data in this article represents third party estimates and are not official operational figures of the company. Please refer to the company's financial report for specific information.
About Hesai
Hesai Group (Nasdaq:HSAI) is a global leader in LIDAR solutions. The company's LIDAR products enable a broad spectrum of applications including passenger and commercial vehicles (""ADAS""), as well as autonomous driving vehicles and robotics and other non-automotive applications such as last-mile delivery robots and AGVs (""Robotics""). Hesai seamlessly integrates its in-house manufacturing process with LIDAR R&D and design, enabling rapid product iteration while ensuring high performance, high quality and affordability. The company's commercially validated solutions are backed by superior R&D capabilities across optics, mechanics, and electronics. Hesai has established offices inShanghai,Palo AltoandStuttgart, with customers spanning more than 40 countries.
About Yole Group
Yole Group offers a comprehensive range of reports, covering market trends, technology insights, teardowns, and reverse costing analyses. For tailored strategic, technical, or market analysis, as well as answers to specific questions, Yole Group also provides custom consulting services.
More information onyolegroup.com-LinkedIn.
SOURCE Hesai Technology",[]
