title,time,date,link,content,symbols_found
All-New Subaru Motorsports USA WRX ARA25L to Debut at Olympus Rally,"Apr 11, 2025, 13:38 ET",2025-04-13,https://www.prnewswire.com/news-releases/all-new-subaru-motorsports-usa-wrx-ara25l-to-debut-at-olympus-rally-302426733.html,"Apr 11, 2025, 13:38 ET
Share this article
SHELTON, Wash.,April 11, 2025/PRNewswire/ -- The all-new WRX ARA25L from Subaru MotorsportsUSAmakes its racing debut atWashington State'sOlympus Rally this weekend. Piloted by extreme sports legend and Subaru MotorsportsUSAdriverTravis Pastrana, the WRX ARA25L will compete within the fast-paced and accessible American Rally Association (ARA) Limited 4-Wheel-Drive (L4WD) class.
L4WD competition cars are heavily modified compared to their stock counterparts but must adhere to specific parameters and restrictions. As such, they remain closely related to the WRX models on the showroom floor – particularly when compared to the cars found in the Open 4-Wheel-Drive (O4WD) class, where Subaru MotorsportsUSAdriverBrandon Semenukand co-driverKeaton Williamsare currently chasing a fourth straight ARA championship.
L4WD competition cars are heavily modified compared to their stock counterparts but must adhere to specific parameters and restrictions. As such, they remain closely related to the WRX models on the showroom floor – particularly when compared to the cars found in the Open 4-Wheel-Drive (O4WD) class, where Subaru MotorsportsUSAdriverBrandon Semenukand co-driverKeaton Williamsare currently chasing a fourth straight ARA championship.
Expertly designed and assembled by performance partner Vermont SportsCar, the WRX ARA25L showcases what is possible with a much closer to stock Subaru WRX while offering drivers the chance to compete withTravis Pastranaat a significantly lower price point than that of the O4WD class. The heart of the WRX ARA25L is its turbocharged and intercooled 2.4-liter Subaru FA24 BOXER engine. With its factory turbocharger, ARA L4WD class-mandated 33mm restrictor and 2.5-bar absolute boost limit, the ARA25L's engine produces roughly 315 horsepower and 460 lb-ft of torque. Power is sent to all four wheels via a 6-speed sequential gearbox with a 3-plate carbon race clutch.
Suspension duties are handled by R53 motorsport springs and dampers along with a combination of OEM and VSC hardware, and the WRX ARA25L's 15-inch O.Z. Competition wheels wear Yokohama ADVAN A053 rally tires. Brembo 4-piston brake calipers and 300mm brake rotors front and rear bring everything to a halt.
According to Pastrana, fresh out of the car on day one of testing, the WRX ARA25L is""a really fun car to drive""with""less downforce than the open car, which adds even more to the fun factor. It drives like a 125cc 2-stroke – you're always shiftin' and movin'!""
The anticipation for Pastrana's 2025 ARA debut has been building, and now with the reveal of the WRX ARA25L and Subaru MotorsportsUSA'sparticipation in L4WD there are more reasons than ever to go spectate – or enter – a rally. Look for Pastrana and the WRX ARA25L at ARA events all season long, including some Super Regionals like July's Rally Colorado, and for the latest news and updates be sure to follow Subaru MotorsportsUSAonFacebook, on Instagram@subarumotorsportsusa, and TikTok@subarumotorsportsusa.
About Subaru MotorsportsUSASubaru MotorsportsUSAis directed bySubaru of America, Inc., managed byVermont SportsCarand proudly supported byMOTUL,Yokohama Tires,R53 Suspension,Triple-R Lights,DirtFish Rally School, andSparcoUSA. Follow the team online atwww.subaru.com/motorsports.Follow Subaru MotorsportsUSAonFacebook, on Instagram@subarumotorsportsusa, and on TikTok@subarumotorsportsusa.About Subaru of America, Inc.Subaru of America, Inc.(SOA) is an indirect wholly owned subsidiary ofSubaru CorporationofJapan. Headquartered at a zero-landfill office inCamden, N.J., the company markets and distributes Subaru vehicles, parts, and accessories through a network of more than 630 retailers acrossthe United States. All Subaru products are manufactured in zero-landfill plants andSubaru of Indiana Automotive, Inc.is the only U.S. automobile manufacturing plant to be designated a backyard wildlife habitat by the National Wildlife Federation. SOA is guided by theSubaru Love Promise, which is the company's vision to show love and respect to everyone, and to support its communities and customers nationwide. Over the past 20 years, SOA and the SOA Foundation have donated more than$300 millionto causes the Subaru family cares about, and its employees have logged nearly 88,000 volunteer hours. As a company, Subaru believes it is important to do its part in making a positive impact in the world because it is the right thing to do. For additional information visitmedia.subaru.com. Follow us onFacebookandInstagram.
James TateMotorsports Marketing ManagerSubaru of America, Inc.(856) 488-8622[email protected]
Dominick InfanteDirector, Corporate CommunicationsSubaru of America, Inc.(856) 488-8615[email protected]
SOURCE Subaru of America, Inc.",[]
"Kengyi Technology (Guangdong) Co., Ltd. Lancement des modèles phares de NLP Motorcycles au salon de Pékin 2025","Apr 11, 2025, 13:16 ET",2025-04-13,https://www.prnewswire.com/news-releases/kengyi-technology-guangdong-co-ltd-lancement-des-modeles-phares-de-nlp-motorcycles-au-salon-de-pekin-2025-302426714.html,"Apr 11, 2025, 13:16 ET
Share this article
PEKIN,11 avril 2025/PRNewswire/ --NLP Motorcycles, marque mondiale de motos de luxe, a présenté ses modèles phares haute performance (leDEVILS ST Serieset l'ULTAIL GL Series) lors du Salon international de la moto de Pékin 2025 (stand H12, Hall W2). Ce lancement souligne l'approche de NLP« production conforme + personnalisation haut de gamme », qui surmonte les restrictions traditionnelles en matière de modification pour offrir des solutions légales, performantes et personnalisées aux pilotes du monde entier, redéfinissant ainsi la valeur des motos haut de gamme.
Innovation fondamentale : La conformité rencontre la personnalisationLes motos NLP sont conformes ausystème de certification mondial WMIet aux normes 3C. Elles sont produites dans des usines à l'étranger, afin de garantir la conformité de l'enregistrement à l'échelon national, éliminant ainsi les obstacles relatifs à la réglementation régionale. En concevant des véhicules qui transcendent les limites de modification imposées par la loi chinoise ""1087"", NLP résout les problèmes de compatibilité et d'après-vente, ce qui permet de proposer une« personnalisation légale et une conduite sans souci ».
Innovation fondamentale : La conformité rencontre la personnalisationLes motos NLP sont conformes ausystème de certification mondial WMIet aux normes 3C. Elles sont produites dans des usines à l'étranger, afin de garantir la conformité de l'enregistrement à l'échelon national, éliminant ainsi les obstacles relatifs à la réglementation régionale. En concevant des véhicules qui transcendent les limites de modification imposées par la loi chinoise ""1087"", NLP résout les problèmes de compatibilité et d'après-vente, ce qui permet de proposer une« personnalisation légale et une conduite sans souci ».
Vision de la marque : La liberté au-delà des frontièresNLP affirme que :« La liberté de faire de la moto doit l'emporter sur les politiques, les coûts ou les barrières techniques. Nous donnons aux pilotes les moyens de fusionner la technologie et l'art, en mettant leurs motos à leur image ».
Impact stratégique : Redéfinir la mobilité de luxeNLP est le pionnierde la personnalisation du luxe conformément aux dispositions légales de circulation, fusionnant performance et exclusivité tout en faisant évoluer le comportement des consommateurs pour les inciter à passer des achats normalisés àdes « écosystèmes de mobilité personnalisés ».Il établit des références techniques et commerciales évolutives pour les marchés mondiaux de produits sur mesure.
À propos de NLP MotorcyclesNLP réinvente la culture de la conduite grâce à une ingénierie et une conception de pointe, en proposant des véhicules conformes, une personnalisation sur mesure et des services de cycle de vie visant à faire progresser la légalisation, la personnalisation et la durabilité du secteur.
Relations avec la presse :Peggy | Tel: +86-13929919443 | E-mail :[email protected]
(Pour plus de détails, voir le stand H12, Hall W2 – Salon de la moto de Pékin 2025.)
Photo -https://mma.prnewswire.com/media/2662738/1.jpg",[]
"Kengyi Technology (Guangdong) Co., Ltd. Einführung der Flaggschiff-Modelle von NLP Motorcycles auf der 2025 Beijing Expo","Apr 11, 2025, 13:05 ET",2025-04-13,https://www.prnewswire.com/news-releases/kengyi-technology-guangdong-co-ltd-einfuhrung-der-flaggschiff-modelle-von-nlp-motorcycles-auf-der-2025-beijing-expo-302426708.html,"Apr 11, 2025, 13:05 ET
Share this article
BEIJING,11.April 2025/PRNewswire/ --NLP Motorcycles, eine globale Luxusmotorradmarke, stellte auf der 2025 Beijing International Motorcycle Exhibition (Stand H12, Halle W2) erstmals seine leistungsstarken Flaggschiff-Modelle vor:die DEVILS ST Serieund dieULTAIL GL Serie. Dieses Debüt unterstreicht den„compliant production + premium customization""(etwa: konforme Herstellung + Premium-Individualisierung) Ansatz von NLP, der traditionelle Modifikationsbeschränkungen überwindet, um legale, leistungsstarke und individuelle Lösungen für Fahrer auf der ganzen Welt zu liefern und den Wert von Premium-Motorrädern neu zu definieren.
Die wichtigste Innovation: Konformität trifft IndividualisierungNLP-Motorräder entsprechen demglobalen WMI-Zertifizierungssystemund den 3C-Standards und werden in Fabriken in Übersee hergestellt, um die landesweite Zulassung zu gewährleisten und regionale regulatorische Hürden zu beseitigen. Durch die Entwicklung von Fahrzeugen, die die „1087""-Grenzen für Modifikationen inChinaüberschreiten, löst NLP Kompatibilitäts- und Nachverkaufsprobleme und ermöglicht„legale Anpassungen, sorgenfreies Fahren"".
Die wichtigste Innovation: Konformität trifft IndividualisierungNLP-Motorräder entsprechen demglobalen WMI-Zertifizierungssystemund den 3C-Standards und werden in Fabriken in Übersee hergestellt, um die landesweite Zulassung zu gewährleisten und regionale regulatorische Hürden zu beseitigen. Durch die Entwicklung von Fahrzeugen, die die „1087""-Grenzen für Modifikationen inChinaüberschreiten, löst NLP Kompatibilitäts- und Nachverkaufsprobleme und ermöglicht„legale Anpassungen, sorgenfreies Fahren"".
Markenvision: Freiheit jenseits von GrenzenNLP erklärt:„Die Fahrfreiheit muss über Politik, Kosten oder technische Barrieren hinausgehen. Wir ermöglichen es den Fahrern, Technologie und Kunstfertigkeit zu vereinen und ihre Motorräder in eine Erweiterung ihrer Identität zu verwandeln.""
Strategische Auswirkungen: Neudefinition der LuxusmobilitätNLP ist Vorreiter bei derstraßenzugelassenen Luxusindividualisierung, die Leistung mit Exklusivität verbindet und gleichzeitig das Kundenverhalten von standardisierten Käufen auf„personalisierte Mobilitätsökosysteme"" verlagert.Das Unternehmen setzt skalierbare technische und kommerzielle Maßstäbe für globale Märkte und kundenspezifische Produkte.
Informationen zu NLP MotorcyclesNLP definiert die Fahrkultur durch modernste Technik und Design neu und bietet konforme Fahrzeuge, maßgeschneiderte Individualisierungen und Lifecycle-Services, um Legalisierung, Personalisierung und Nachhaltigkeit in der Branche voranzutreiben.
Medienkontakt:Peggy | Tel.: +86-13929919443 | E-Mail:[email protected]
(Weitere Informationen finden Sie am Stand H12, Halle W2 - 2025 Beijing Motorcycle Exhibition).
Foto –https://mma.prnewswire.com/media/2662738/1.jpg",[]
SUBARU ANNOUNCES GLOBAL DEBUT OF ALL-NEW 2026 SUBARU TRAILSEEKER AT 2025 NEW YORK INTERNATIONAL AUTO SHOW,"Apr 11, 2025, 13:00 ET",2025-04-13,https://www.prnewswire.com/news-releases/subaru-announces-global-debut-of-all-new-2026-subaru-trailseeker-at-2025-new-york-international-auto-show-302426694.html,"Apr 11, 2025, 13:00 ET
Share this article
CAMDEN, N.J.,April 11, 2025/PRNewswire/ -- Get ready to meet your newest adventure-ready sidekick from Subaru: the all-new 2026 Subaru Trailseeker EV SUV. See it in person at the 2025 New York International Auto Show, coming soon.
CheckSubaru's Media Centerfor more information.
About Subaru of America, Inc.Subaru of America, Inc.(SOA) is an indirect wholly owned subsidiary ofSubaru Corporationof Japan. Headquartered in Camden, N.J., the company markets and distributes Subaru vehicles, parts, and accessories through a network of about 640 retailers across the United States. All Subaru products are manufactured in zero-landfill plants, includingSubaru of Indiana Automotive, Inc., the only U.S. automobile manufacturing plant designated a backyard wildlife habitat by the National Wildlife Federation. SOA is guided by theSubaru Love Promise, which is the company's vision to show love and respect to everyone and to support its communities and customers nationwide. Over the past 20 years, SOA and the SOA Foundation have donated more than $320 million to causes the Subaru family cares about, and its employees have logged over 100,000 volunteer hours. Subaru is dedicated to being More Than a Car Company® and to making the world a better place. For additional information, visitmedia.subaru.com. Follow us onFacebook,Instagram,LinkedIn,TikTok, andYouTube.
Dominick InfanteDirector, Corporate Communications856.488.8615[email protected]
Aaron ColeProduct Communications Manager856.488.3697[email protected]
Miranda JimenezProduct Communications Specialist856.438.2820[email protected]
SOURCE Subaru of America, Inc.",[]
HONGQI E-HS9 wird offiziell VIP-Servicefahrzeug am Frankfurter Flughafen,"Apr 11, 2025, 12:59 ET",2025-04-13,https://www.prnewswire.com/news-releases/hongqi-e-hs9-wird-offiziell-vip-servicefahrzeug-am-frankfurter-flughafen-302426706.html,"Apr 11, 2025, 12:59 ET
Share this article
FRANKFURT, Deutschland,11.April 2025/PRNewswire/ -- Der HONGQI E-HS9 wurde offiziell in die VIP-Serviceflotte des Frankfurter Flughafens aufgenommen und bietet damit einen erstklassigen und komfortablen Transport für wichtige Gäste, einschließlich hochrangiger Regierungsvertreter und Wirtschaftsführer. Mit seinem anspruchsvollen Design und seinen fortschrittlichen Funktionen bringt der HONGQI E-HS9 unvergleichlichen Luxus in den VIP-Service des Frankfurter Flughafens.
Seit derersten Auslieferung des HONGQI E-HS9 an den Frankfurter Flughafen und dem anschließenden Probebetrieb im vergangenen Jahr wurde er für seine außergewöhnlichen Fahreigenschaften und die herausragende Fahrsicherheit hoch gelobt, zudem zeichnet er sich durch hervorragende Leistung und Verarbeitung aus. Dieses positive Feedback hat nicht nur das Vertrauen des Flughafens in die Marke HONGQI gestärkt, sondern auch eine solide Grundlage für die weitere Zusammenarbeit geschaffen. Der Flughafen plant nun, den HONGQI H9 in seine Flotte zu integrieren, um die Partnerschaft zu stärken und gemeinsam das Luxusreiseerlebnis zu verbessern.
Seit derersten Auslieferung des HONGQI E-HS9 an den Frankfurter Flughafen und dem anschließenden Probebetrieb im vergangenen Jahr wurde er für seine außergewöhnlichen Fahreigenschaften und die herausragende Fahrsicherheit hoch gelobt, zudem zeichnet er sich durch hervorragende Leistung und Verarbeitung aus. Dieses positive Feedback hat nicht nur das Vertrauen des Flughafens in die Marke HONGQI gestärkt, sondern auch eine solide Grundlage für die weitere Zusammenarbeit geschaffen. Der Flughafen plant nun, den HONGQI H9 in seine Flotte zu integrieren, um die Partnerschaft zu stärken und gemeinsam das Luxusreiseerlebnis zu verbessern.
Die HONGQI-Modelle E-HS9 und H9 integrieren nahtlos fortschrittliche Technologie mit exquisitem Design. Mit ihren außergewöhnlichen Fahreigenschaften und einer raffinierten und anspruchsvollen Innenausstattung bieten sie jedem Fahrgast einen komfortablen Rückzugsort und ein elegantes Ambiente für wertvolle Momente der Entspannung. Die leistungsstarke ternäre Lithium-Ionen-Batterie und der Dual-Motor-Allradantrieb des E-HS9 sorgen dafür, dass jede Fahrt effizient und angenehm verläuft. Die Liebe zum Detail ist für HONGQI essentiell, mit exklusiven Merkmalen wie dem beleuchteten „Wing of HONGQI""-Willkommenslicht auf dem H9, was die Eleganz der Marke unterstreicht. Das Electronic Courtesy System nutzt fortschrittliche Technologie, um VIPs ein intelligentes und komfortables Reiseerlebnis zu bieten. Die HONGQI-Modelle E-HS9 und H9 verkörpern perfekt die Verschmelzung von Luxus, Eleganz und Komfort und bieten jedes Mal ein außergewöhnliches und raffiniertes Reiseerlebnis.
Der E-HS9 ist das erste Fahrzeug von HONGQI, das nach Europa exportiert wird. Seit seiner Einführung 2020 hat er auf dem europäischen Markt große Aufmerksamkeit erregt in Ländern wie Norwegen, den Niederlanden und Schweden. Die Aufnahme der Modelle E-HS9 und H9 in die VIP-Flotte des Frankfurter Flughafens erweitert nicht nur das Luxusangebot des Flughafens, sondern festigt auch die Position von HONGQI als einer der Hauptakteure im globalen Luxusautomobilsektor. Die neuesten Modelle von HONGQI, der EH7 und der EHS7, wurden bereits auf den Markt gebracht und sind jetzt zum Verkauf verfügbar; eine erste Charge von Fahrzeugen ist auch bereits in Europa eingetroffen. Für die Zukunft plant HONGQI die Einführung weiterer Fahrzeuge mit alternativer Antriebstechnik auf dem europäischen Markt, um europäischen Kunden weiterhin exklusive und luxuriöse Fahrzeugoptionen zu bieten.
Website:https://www.hongqi-auto.comEHS9:https://www.hongqi-auto.com/go/bVFWxffzH9:https://www.hongqi-auto.com/go/2SXq2d3DEHS7:https://www.hongqi-auto.com/go/EFRv5UQyEH7:https://www.hongqi-auto.com/go/UoPMng9t
Photo –https://mma.prnewswire.com/media/2662793/image_5028817_38419043.jpg",[]
InventHelp Inventor Develops Medical Emergency Lights for Vehicles (PTA-236),"Apr 11, 2025, 12:30 ET",2025-04-13,https://www.prnewswire.com/news-releases/inventhelp-inventor-develops-medical-emergency-lights-for-vehicles-pta-236-302419929.html,"Apr 11, 2025, 12:30 ET
Share this article
PITTSBURGH,April 11, 2025/PRNewswire/ -- ""I wanted to create an effective way to signal for help if experiencing a seizure or heart attack while driving,"" said an inventor, from Tigard, Ore., ""so I invented the MEDICAL EMERGENCY LIGHTS. My design enables you to request emergency medical assistance, and it could offer peace of mind for safety-conscious motorists with health-related issues.""
The invention provides an improved emergency medical signal for motorists. In doing so, it would prompt others to call for help so an ambulance arrives on the scene in the quickest manner possible. As a result, it saves time, and it increases safety. The invention features an attention-getting design that is easy to use so it is ideal for vehicle owners, especially those who are elderly and/or suffer from medical issues.
The original design was submitted to thePortlandsales office of InventHelp. It is currently available for licensing or sale to manufacturers or marketers. For more information, write Dept. 23-PTA-236, InventHelp, 100 Beecham Drive, Suite 110,Pittsburgh, PA15205-9801, or call (412) 288-1300 ext. 1368. Learn more about InventHelp's Invention Submission Services athttp://www.InventHelp.com.
SOURCE InventHelp",[]
Le HONGQI E-HS9 devient officiellement un véhicule de service VIP à l'aéroport de Francfort,"Apr 11, 2025, 12:23 ET",2025-04-13,https://www.prnewswire.com/news-releases/le-hongqi-e-hs9-devient-officiellement-un-vehicule-de-service-vip-a-laeroport-de-francfort-302426692.html,"Apr 11, 2025, 12:23 ET
Share this article
FRANCFORT, Allemagne,11 avril 2025/PRNewswire/ -- Le HONGQI E-HS9 devient officiellement un véhicule de service VIP à l'aéroport de Francfort, proposant un mode de transport haut de gamme et confortable aux invités de marque, y compris les hauts fonctionnaires et les chefs d'entreprise. Avec son design sophistiqué et ses fonctions avancées, le HONGQI E-HS9 apporte un luxe inégalé au service VIP de l'aéroport de Francfort.
Depuis lapremière livraison du HONGQI E-HS9 à l'aéroport de Francfort et sa mise à l'essai l'année dernière, il a été encensé pour sa qualité de conduite exceptionnelle et sa sécurité de conduite, témoignant de performances et d'une qualité de fabrication remarquables. Ces commentaires positifs ont non seulement renforcé la confiance de l'aéroport dans la marque HONGQI, mais ont également établi des bases solides pour la poursuite de la collaboration. L'aéroport prévoit maintenant d'intégrer le HONGQI H9 dans sa flotte, renforçant ainsi le partenariat et améliorant conjointement l'expérience en matière de voyage de luxe.
Depuis lapremière livraison du HONGQI E-HS9 à l'aéroport de Francfort et sa mise à l'essai l'année dernière, il a été encensé pour sa qualité de conduite exceptionnelle et sa sécurité de conduite, témoignant de performances et d'une qualité de fabrication remarquables. Ces commentaires positifs ont non seulement renforcé la confiance de l'aéroport dans la marque HONGQI, mais ont également établi des bases solides pour la poursuite de la collaboration. L'aéroport prévoit maintenant d'intégrer le HONGQI H9 dans sa flotte, renforçant ainsi le partenariat et améliorant conjointement l'expérience en matière de voyage de luxe.
Les HONGQI E-HS9 et H9 intègrent harmonieusement une technologie de pointe et un design recherché. La qualité de conduite exceptionnelle, associée à des intérieurs raffinés et sophistiqués, offre à chaque passager un moment de détente privé et élégant. La batterie au lithium-ion ternaire haute performance du E-HS9 et son système de traction à quatre roues motrices à double moteur garantissent l'efficacité et la fluidité de chaque trajet. L'attention portée aux détails est essentielle pour HONGQI, avec des caractéristiques exclusives telles que les lumières d'accueil illuminées « Wing of HONGQI » sur le H9, qui mettent en valeur l'élégance de la marque. Le système de courtoisie électronique s'appuie sur une technologie de pointe pour offrir aux VIP une expérience de voyage intelligente et confortable. Les HONGQI E-HS9 et H9 incarnent parfaitement la fusion du luxe, de l'élégance et du confort, offrant à chaque fois un voyage extraordinaire et raffiné.
L'E-HS9 est le premier véhicule de HONGQI à être exporté enEurope. Depuis son lancement en 2020, il a suscité un vif intérêt sur le marché européen, en pénétrant dans des pays tels que la Norvège, les Pays-Bas et la Suède. L'ajout des E-HS9 et H9 à la flotte VIP de l'aéroport de Francfort renforce non seulement l'offre de services de luxe de l'aéroport, mais consolide également la position de HONGQI en tant qu'acteur clé dans le secteur mondial de l'automobile de luxe. Notamment, les derniers modèles de HONGQI, les EH7 et EHS7, ont déjà été lancés et sont désormais disponibles à la vente, le premier lot de véhicules étant déjà arrivé enEurope. À l'avenir, HONGQI prévoit d'introduire davantage de véhicules à énergie nouvelle sur le marché européen, continuant ainsi à proposer des options de conduite exclusives et luxueuses aux clients européens.
Site web :https://www.hongqi-auto.comEHS9 :https://www.hongqi-auto.com/go/bVFWxffzH9 :https://www.hongqi-auto.com/go/2SXq2d3DEHS7 :https://www.hongqi-auto.com/go/EFRv5UQyEH7 :https://www.hongqi-auto.com/go/UoPMng9t
Photo -https://mma.prnewswire.com/media/2662793/image_5028817_38419043.jpg",[]
